{
  "schema_version": 1,
  "updated": "2026-10-19",
  "aa_intelligence_index_version": "v4.3.2",
  "source_note": {
    "zh": "质量分（AA Intelligence Index）、速度、任务成本参考 Artificial Analysis（artificialanalysis.ai）2026-10 公开数据，经人工整理为档位与别名映射。具体价格一律以使用站点自身定价为准，本文件价格字段仅供参考。",
    "en": "Quality (AA Intelligence Index), speed and cost-per-task reference Artificial Analysis (artificialanalysis.ai) Oct 2026 public data, manually curated into tiers and alias mappings. Actual prices are always set by the site's own pricing; price fields here are indicative only."
  },
  "models": [
    {
      "id": "claude-opus-5-5",
      "name": "Claude Opus 5.5",
      "creator": "Anthropic",
      "kind": "llm",
      "context_tokens": 1000000,
      "modalities": { "in": ["text", "image"], "out": ["text"] },
      "quality": {
        "tier": "S",
        "aa_intelligence_index": 58,
        "as_of": "2026-10",
        "variants": [
          { "effort": "max", "index": 58 },
          { "effort": "xhigh", "index": 56 },
          { "effort": "high", "index": 54 },
          { "effort": "medium", "index": 51 },
          { "effort": "low", "index": 42 }
        ]
      },
      "speed": { "tier": "normal", "median_tokens_per_s": 98, "as_of": "2026-10" },
      "price": { "tier": "premium", "aa_cost_per_task_usd": 5.98, "as_of": "2026-10" },
      "strengths": ["agent", "coding", "writing", "long-context", "reasoning"],
      "blurb": {
        "zh": "当前智力天花板（AA 指数 58），复杂 agent 任务与长链路工作首选；max 档价格高，低 effort 档位性价比会好很多。",
        "en": "Current intelligence ceiling (AA index 58); first pick for complex agents and long tasks. Max effort is pricey — lower efforts are far better value."
      },
      "aliases": ["claude-opus-5.5", "claude-opus-5.5-max", "claude-opus-5-5-max", "anthropic/claude-opus-5.5"],
      "open_weights": false,
      "sources": ["https://artificialanalysis.ai/models/claude-opus-5-5"]
    },
    {
      "id": "claude-sonnet-5-5",
      "name": "Claude Sonnet 5.5",
      "creator": "Anthropic",
      "kind": "llm",
      "context_tokens": 1000000,
      "modalities": { "in": ["text", "image"], "out": ["text"] },
      "quality": {
        "tier": "S",
        "aa_intelligence_index": 56,
        "as_of": "2026-10",
        "variants": [
          { "effort": "max", "index": 56 },
          { "effort": "xhigh", "index": 52 },
          { "effort": "high", "index": 47 },
          { "effort": "medium", "index": 41 },
          { "effort": "low", "index": 36 }
        ]
      },
      "speed": { "tier": "normal", "median_tokens_per_s": 136, "as_of": "2026-10" },
      "price": { "tier": "premium", "aa_cost_per_task_usd": 5.46, "as_of": "2026-10" },
      "strengths": ["coding", "agent", "writing", "long-context"],
      "blurb": {
        "zh": "Claude 均衡主力：智力仅次于 Opus 5.5，速度快一截，max 档外都很划算，多数团队的默认编码/agent 款。",
        "en": "Balanced Claude workhorse: just behind Opus 5.5 in intelligence, faster, and much cheaper below max effort. Default coding/agent pick for most teams."
      },
      "aliases": ["claude-sonnet-5.5", "claude-sonnet-5.5-max", "claude-sonnet-5-5-max", "anthropic/claude-sonnet-5.5"],
      "open_weights": false,
      "sources": ["https://artificialanalysis.ai/models/claude-sonnet-5-5"]
    },
    {
      "id": "claude-haiku-5-5",
      "name": "Claude Haiku 5.5",
      "creator": "Anthropic",
      "kind": "llm",
      "context_tokens": 1000000,
      "modalities": { "in": ["text", "image"], "out": ["text"] },
      "quality": {
        "tier": "A",
        "aa_intelligence_index": 43,
        "as_of": "2026-10",
        "variants": [
          { "effort": "max", "index": 43 },
          { "effort": "xhigh", "index": 41 },
          { "effort": "high", "index": 38 },
          { "effort": "medium", "index": 34 },
          { "effort": "low", "index": 29 }
        ]
      },
      "speed": { "tier": "fast", "median_tokens_per_s": 232, "as_of": "2026-10" },
      "price": { "tier": "budget", "aa_cost_per_task_usd": 0.21, "as_of": "2026-10" },
      "strengths": ["fast", "cheap", "vision", "long-context"],
      "blurb": {
        "zh": "Claude 轻量款：232 tok/s 高速输出，A 档智力只要 $0.21/任务，高并发与简单任务的高性价比首选。",
        "en": "Lightweight Claude: 232 tok/s and $0.21/task at A-tier intelligence. Great value for high-volume, simpler tasks."
      },
      "aliases": ["claude-haiku-5.5", "claude-haiku-5.5-max", "anthropic/claude-haiku-5.5"],
      "open_weights": false,
      "sources": ["https://artificialanalysis.ai/models/claude-haiku-5-5"]
    },
    {
      "id": "claude-fable-5-1",
      "name": "Claude Fable 5.1",
      "creator": "Anthropic",
      "kind": "llm",
      "context_tokens": 1000000,
      "quality": {
        "tier": "S",
        "aa_intelligence_index": 53,
        "as_of": "2026-10",
        "variants": [
          { "effort": "max", "index": 53 },
          { "effort": "xhigh", "index": 53 },
          { "effort": "high", "index": 51 },
          { "effort": "medium", "index": 49 },
          { "effort": "low", "index": 47 }
        ]
      },
      "speed": { "tier": "slow", "median_tokens_per_s": 68, "as_of": "2026-10" },
      "price": { "tier": "premium", "aa_cost_per_task_usd": 7.63, "as_of": "2026-10" },
      "strengths": ["reasoning", "writing", "agent"],
      "blurb": {
        "zh": "Anthropic 另一条旗舰线，智力接近 Opus 但更贵、更慢；低 effort 档（47）反而是同系列性价比点，适合深度写作与推敲类任务。",
        "en": "Anthropic's second flagship line: near-Opus intelligence but pricier and slower; its low-effort tier (47) is the value point. Suits deep writing and deliberation work."
      },
      "aliases": ["claude-fable-5.1", "claude-fable-5.1-max", "anthropic/claude-fable-5.1"],
      "open_weights": false,
      "sources": ["https://artificialanalysis.ai/models/claude-fable-5-1"]
    },
    {
      "id": "gpt-6-astra",
      "name": "GPT-6 Astra",
      "creator": "OpenAI",
      "kind": "llm",
      "context_tokens": 1000000,
      "modalities": { "in": ["text", "image"], "out": ["text"] },
      "quality": {
        "tier": "S",
        "aa_intelligence_index": 53,
        "as_of": "2026-10",
        "variants": [
          { "effort": "max", "index": 53 },
          { "effort": "xhigh", "index": 52 },
          { "effort": "high", "index": 51 },
          { "effort": "medium", "index": 50 },
          { "effort": "low", "index": 46 }
        ]
      },
      "speed": { "tier": "normal", "median_tokens_per_s": 69, "as_of": "2026-10" },
      "price": { "tier": "premium", "aa_cost_per_task_usd": 3.26, "as_of": "2026-10" },
      "strengths": ["reasoning", "agent", "long-context", "vision"],
      "blurb": {
        "zh": "OpenAI GPT-6 旗舰：智力第一梯队，长上下文 1M，多模态输入；effort 各档位都稳，复杂分析类任务用它稳。",
        "en": "OpenAI's GPT-6 flagship: first-tier intelligence, 1M context, multimodal input. Stable across efforts; a safe pick for hard analytical work."
      },
      "aliases": ["gpt-6-astra", "gpt-6-astra-max", "openai/gpt-6-astra"],
      "open_weights": false,
      "sources": ["https://artificialanalysis.ai/models/gpt-6-astra"]
    },
    {
      "id": "gpt-6-1-sol",
      "name": "GPT-6.1 Sol",
      "creator": "OpenAI",
      "kind": "llm",
      "context_tokens": 1000000,
      "modalities": { "in": ["text", "image"], "out": ["text"] },
      "quality": {
        "tier": "S",
        "aa_intelligence_index": 52,
        "as_of": "2026-10",
        "variants": [
          { "effort": "max", "index": 52 },
          { "effort": "xhigh", "index": 51 },
          { "effort": "high", "index": 50 },
          { "effort": "medium", "index": 48 },
          { "effort": "low", "index": 42 }
        ]
      },
      "speed": { "tier": "normal", "median_tokens_per_s": 60, "as_of": "2026-10" },
      "price": { "tier": "mid", "aa_cost_per_task_usd": 0.72, "as_of": "2026-10" },
      "strengths": ["coding", "agent", "cheap", "long-context"],
      "blurb": {
        "zh": "GPT-6 高性价比主力：S 档智力、价格只有 Astra 的零头（$0.72/任务），日常默认款，低档位 $0.21 更狠。",
        "en": "GPT-6's value workhorse: S-tier intelligence at a fraction of Astra's price ($0.72/task). The natural daily default; low effort drops to $0.21."
      },
      "aliases": ["gpt-6.1-sol", "gpt-6-1-sol", "gpt-6.1-sol-max", "openai/gpt-6.1-sol"],
      "open_weights": false,
      "sources": ["https://artificialanalysis.ai/models/gpt-6-1-sol"]
    },
    {
      "id": "gpt-6-luna",
      "name": "GPT-6 Luna",
      "creator": "OpenAI",
      "kind": "llm",
      "context_tokens": 1000000,
      "modalities": { "in": ["text", "image"], "out": ["text"] },
      "quality": {
        "tier": "B",
        "aa_intelligence_index": 38,
        "as_of": "2026-10",
        "variants": [
          { "effort": "max", "index": 38 },
          { "effort": "xhigh", "index": 35 },
          { "effort": "high", "index": 33 },
          { "effort": "medium", "index": 30 },
          { "effort": "low", "index": 22 }
        ]
      },
      "speed": { "tier": "normal", "median_tokens_per_s": 129, "as_of": "2026-10" },
      "price": { "tier": "budget", "aa_cost_per_task_usd": 0.07, "as_of": "2026-10" },
      "strengths": ["cheap", "fast", "long-context", "vision"],
      "blurb": {
        "zh": "GPT-6 家族的成本杀手：$0.07/任务、117 tok/s，轻量任务和批量跑数据首选，别指望它做难题。",
        "en": "The GPT-6 family's cost killer: $0.07/task at 117 tok/s. First pick for bulk and lightweight jobs; not for hard reasoning."
      },
      "aliases": ["gpt-6-luna", "gpt-6-luna-max", "openai/gpt-6-luna"],
      "open_weights": false,
      "sources": ["https://artificialanalysis.ai/models/gpt-6-luna"]
    },
    {
      "id": "gpt-5-6-terra",
      "name": "GPT-5.6 Terra",
      "creator": "OpenAI",
      "kind": "llm",
      "context_tokens": 1000000,
      "modalities": { "in": ["text", "image"], "out": ["text"] },
      "quality": {
        "tier": "A",
        "aa_intelligence_index": 42,
        "as_of": "2026-10",
        "variants": [
          { "effort": "max", "index": 42 },
          { "effort": "xhigh", "index": 38 },